id,author,domain,url,title,score,num_comments
eiu975,TateDance,self.wallstreetbets,https://www.reddit.com/r/wallstreetbets/comments/eiu975/oink_oink_capitalist_pigs/,Oink oink capitalist pigs,1,0
eiu8rw,fallouthong,self.wallstreetbets,https://www.reddit.com/r/wallstreetbets/comments/eiu8rw/is_this_year_going_to_be_tsmcs_first_time_selling/,Is this year going to be TSMC’s first time selling wafers to AMD for consoles?,1,2
eiu126,thehandsoap,self.wallstreetbets,https://www.reddit.com/r/wallstreetbets/comments/eiu126/stocks_dipped_when_trump_got_elected_in_2016_then/,"stocks dipped when trump got elected in 2016, then began skyrocketting, will it happen again?",1,32
eiu0qt,xan_axe,self.wallstreetbets,https://www.reddit.com/r/wallstreetbets/comments/eiu0qt/joe_mamma/,Joe mamma,1,0
eits26,thehandsoap,self.wallstreetbets,https://www.reddit.com/r/wallstreetbets/comments/eits26/goal_of_100k_portfolio_value_in_2020/,Goal of 100K portfolio value in 2020,1,0
eithca,tilly53,self.wallstreetbets,https://www.reddit.com/r/wallstreetbets/comments/eithca/yolo_3_strike_pti_calls/,YOLO $3 strike PTI calls?,1,0
eita0d,mlawr0077,self.wallstreetbets,https://www.reddit.com/r/wallstreetbets/comments/eita0d/free_riding_and_call_options/,Free riding and call options 🤜,1,0
eit0mq,CalinYoEar,i.redd.it,https://i.redd.it/d8n3ujdvha841.jpg,*paid for by BA*,1,10
eit0df,wilywarewolf,self.wallstreetbets,https://www.reddit.com/r/wallstreetbets/comments/eit0df/tesla_fatal_crash_in_los_angeles_on_december_29/,Tesla fatal crash in los Angeles on December 29,1,0
eisgy4,CheatingWhoreJenny,self.wallstreetbets,https://www.reddit.com/r/wallstreetbets/comments/eisgy4/2019_mems/,2019 mems,1,0
eisc19,thatErickkid,self.wallstreetbets,https://www.reddit.com/r/wallstreetbets/comments/eisc19/anyone_gonna_buy_a_shit_ton_of_nok_for_the_new/,Anyone gonna buy a shit ton of $NOK for the new decade?,1,38
eisamk,majd1239,i.redd.it,https://i.redd.it/2lrshre17a841.jpg,"After loosing 250k in bitcoin last year, I decided to try options trading. Reach out to me for trading advice!",1,0
eis9lr,Aztecskingz,self.wallstreetbets,https://www.reddit.com/r/wallstreetbets/comments/eis9lr/whats_the_best_to_invest_with_50/,What’s the best to invest with 50$,1,0
eis0ip,ConnorGracie,i.redd.it,https://i.redd.it/dnc5ieky2a841.jpg,At least we're smarter than these people.,1,0
eirzii,Stewartsw1,self.wallstreetbets,https://www.reddit.com/r/wallstreetbets/comments/eirzii/i_dont_understand_any_of_this/,I don’t understand any of this,1,307
eirz4f,thehandsoap,self.wallstreetbets,https://www.reddit.com/r/wallstreetbets/comments/eirz4f/orange_man_bans_ecig_fruity_flavors/,orange man bans e-cig fruity flavors,1,21
eiruld,thehandsoap,self.wallstreetbets,https://www.reddit.com/r/wallstreetbets/comments/eiruld/orange_man_bans_ecigarette_flavors_except_tobacco/,Orange Man bans E-Cigarette flavors except tobacco and menthol flavor,1,2
eirr7y,RoadhouseSwayz3,i.redd.it,https://i.redd.it/c3mex3x8z9841.jpg,Trending down to nothing. Thanks for all the help team! Not sure why the y-axis is topped at 8.0.. had this at 75k once upon a time...,1,0
eiro4f,HonestCondition8,self.wallstreetbets,https://www.reddit.com/r/wallstreetbets/comments/eiro4f/i_think_ive_found_a_secret/,I think I’ve found a secret,1,0
eirli8,Dondior,self.wallstreetbets,https://www.reddit.com/r/wallstreetbets/comments/eirli8/i_want_to_learn/,I want to learn,1,0
eir68c,socratesyear,self.wallstreetbets,https://www.reddit.com/r/wallstreetbets/comments/eir68c/wanna_quit_your_job_and_drive_a_navy_blue_chevy/,Wanna quit your job and drive a navy blue Chevy Lumina?,1,104
eir5xl,learningoptions,self.wallstreetbets,https://www.reddit.com/r/wallstreetbets/comments/eir5xl/on_a_scale_of_5_to_i_am_sam_how_retarded/,"On a scale of -5 to ""I Am Sam"", how retarded / redundant is this?",1,15
eir0n3,OddSalary,i.redd.it,https://i.redd.it/vwjltzbdo9841.jpg,$NIO in HKG,1,0
eiqx3e,Yangnyum009,self.wallstreetbets,https://www.reddit.com/r/wallstreetbets/comments/eiqx3e/what_are_your_investing_related_new_years/,What are your investing related new year's resolution for 2020?,1,0
eiqvbx,RoadhouseSwayz3,i.redd.it,https://i.redd.it/p8ih3fogm9841.jpg,What a terrible way to spend money and time. Can anyone explain why the y-axis is only 8.00? Pretty sure I had this baby up to 75k before the trend downwards. You’ll notice the lack of dividend as everything is always option’d,1,0
eiqv2i,eltoroloco2001,self.wallstreetbets,https://www.reddit.com/r/wallstreetbets/comments/eiqv2i/can_you_consider_yourself_a_trader_if_you_arent/,Can you consider yourself a trader if you aren’t profitable?,1,18
eiqrtn,CIARRAPUNGI,self.wallstreetbets,https://www.reddit.com/r/wallstreetbets/comments/eiqrtn/how_do_i_buy_usa_options_from_europe/,How do I buy USA options from Europe?,1,0
eiqing,xxx_trojanwormdotexe,i.redd.it,https://i.redd.it/gi3baaxeh9841.jpg,It's been an incredible one month. Thank you WSB!,1,0
eiqb6f,RoadhouseSwayz3,self.wallstreetbets,https://www.reddit.com/r/wallstreetbets/comments/eiqb6f/anyone_follow_msci_for_index/,Anyone follow $MSCI for index??,1,14
eiq6a5,wired2trade,self.wallstreetbets,https://www.reddit.com/r/wallstreetbets/comments/eiq6a5/do_any_of_the_dumbasses_that_lost_huge_on_the_rh/,Do Any Of The Dumbasses That Lost Huge On The RH Leverage Exploit Wanna Give Us An Update?,1,82
eipxnr,op9468,self.wallstreetbets,https://www.reddit.com/r/wallstreetbets/comments/eipxnr/good_time_to_get_on_blue/,Good time to get on $BLUE,1,19
eipusd,bd_one,i.imgflip.com,https://i.imgflip.com/3kywdh.jpg,"If you thought your 2019 was bad, at least you aren't Daily Discussion guy's friend",1,1
eipn7c,IpMedia,self.wallstreetbets,https://www.reddit.com/r/wallstreetbets/comments/eipn7c/i_will_remember/,I will remember,1,5
eipbic,Hobbstc,i.redd.it,https://i.redd.it/x08h28sn09841.jpg,CHWY to the moon!,1,0
eipbbd,DrSecret007,self.wallstreetbets,https://www.reddit.com/r/wallstreetbets/comments/eipbbd/new_years_challenge_5k_makeit_or_breakit/,New Years Challenge: 5K Make-it or Break-it,1,106
eip6af,phoq5,self.wallstreetbets,https://www.reddit.com/r/wallstreetbets/comments/eip6af/how_many_of_you_tisms_are_doing_the_uprotmf_mix/,How many of you tism's are doing the UPRO/TMF mix?,1,40
eiotmh,crap_muffin69,i.redd.it,https://i.redd.it/raduylwst8841.png,The slight hump up is when I discovered options,1,0
eioqkv,jojobarnhill,self.wallstreetbets,https://www.reddit.com/r/wallstreetbets/comments/eioqkv/exclusive_airbus_beats_goal_with_863_jet/,"Exclusive: Airbus beats goal with 863 jet deliveries in 2019, ousts Boeing from top spot",1,9
eiop5s,jojobarnhill,self.wallstreetbets,https://www.reddit.com/r/wallstreetbets/comments/eiop5s/exclusive_airbus_beats_goal_with_863_jet/,"Exclusive: Airbus beats goal with 863 jet deliveries in 2019, ousts Boeing from top spot",1,0
eiop2z,Black_Ink,self.wallstreetbets,https://www.reddit.com/r/wallstreetbets/comments/eiop2z/dd_on_pot_stocks/,DD on pot stocks,1,20
eioo45,regcha,self.wallstreetbets,https://www.reddit.com/r/wallstreetbets/comments/eioo45/new_year_new_baseline_new_records_we_can_only_go/,"New year, new baseline, new records. We can only go up!, to the moon!",1,0
eiold6,wooooooooooooosssshh,i.redd.it,https://i.redd.it/oo37ig54q8841.jpg,Barstool knows best. Buying $LULU puts,1,0
eiogf6,nemo1080,imgur.com,https://imgur.com/lNrQdzD,Shitpost Long $LULU $BECKY,1,0
eio7dn,jeweled_sky,self.wallstreetbets,https://www.reddit.com/r/wallstreetbets/comments/eio7dn/day_trading_how_i_lost_it_all/,"Day Trading, how I lost it all.",1,643
eio1hu,tombomassasin,i.redd.it,https://i.redd.it/9vxfswepi8841.jpg,With possible aimt and epzm fda approval coming up what are yall thoughts on it?,1,0
eio01g,SomeGuyInDeutschland,i.redd.it,https://i.redd.it/ae1otc82i8841.png,Financial History,1,0
einzb0,Eldsjal,self.wallstreetbets,https://www.reddit.com/r/wallstreetbets/comments/einzb0/i_wannabe_make_money_be_rich/,I wannabe make money be rich,1,12
einz9m,OptionRunners,self.wallstreetbets,https://www.reddit.com/r/wallstreetbets/comments/einz9m/markets_are_on_the_cusp_of_a_correction_and/,Markets are on the cusp of a correction and there's opportunity for mega tendies in the next month,1,240
einx0a,LongtermSquirrelish,self.wallstreetbets,https://www.reddit.com/r/wallstreetbets/comments/einx0a/psn_parsons_company/,PSN Parsons Company,1,9
einwh5,InKanosWeTrust,self.wallstreetbets,https://www.reddit.com/r/wallstreetbets/comments/einwh5/literally_free_money/,Literally Free Money,1,17
einvbk,69SluttyPoptarts,self.wallstreetbets,https://www.reddit.com/r/wallstreetbets/comments/einvbk/advanced_portfolio_funding_strategy/,Advanced portfolio funding strategy,1,8
einsgv,tulsagrowguy,self.wallstreetbets,https://www.reddit.com/r/wallstreetbets/comments/einsgv/teach_me_your_ways_shorting_dry_stock_vessels/,Teach me your ways - Shorting Dry Stock Vessels,1,6
einrlu,AutoModerator,self.wallstreetbets,https://www.reddit.com/r/wallstreetbets/comments/einrlu/what_are_your_moves_tomorrow_january_02/,"What Are Your Moves Tomorrow, January 02",1,1798
einqmq,vtsaxforglory,imgur.com,https://imgur.com/a/vMPNmMo,"Playing the long game, soon I'll be a millionaire.",1,0
ein4nt,cdc3298,i.redd.it,https://i.redd.it/gk7ipdqf68841.jpg,"Thanks for the hangover heart attack this morning, E*Trade...",1,1
ein18r,CharlesStross,self.wallstreetbets,https://www.reddit.com/r/wallstreetbets/comments/ein18r/best_stock_to_take_advantage_of_undervalued/,Best stock to take advantage of undervalued commodities?,1,14
eimigb,YaBoy_Milo,self.wallstreetbets,https://www.reddit.com/r/wallstreetbets/comments/eimigb/please_help_now_please_assist/,Please help now please assist,1,6
eim1g2,vntoknt0,self.wallstreetbets,https://www.reddit.com/r/wallstreetbets/comments/eim1g2/real_reason_intel_why_failed_to_deliver_10nm_for/,Real reason Intel why failed to deliver 10nm for so long is because of feminism,1,91
eim0fn,thekillerz99,self.wallstreetbets,https://www.reddit.com/r/wallstreetbets/comments/eim0fn/how_long_until_we_see_rivian_ipo/,How Long Until We See Rivian IPO?,1,0
eilqxl,DesignerFreedom,self.wallstreetbets,https://www.reddit.com/r/wallstreetbets/comments/eilqxl/aimt_timing/,AIMT Timing,1,19
eilorf,This-Organization,self.wallstreetbets,https://www.reddit.com/r/wallstreetbets/comments/eilorf/aimt_timing/,AIMT Timing,1,0
eilld6,brocklantern,self.wallstreetbets,https://www.reddit.com/r/wallstreetbets/comments/eilld6/withhold_taxes_all_year_its_cheaper_than_margin/,"Withhold taxes all year, it's cheaper than margin.",1,1
eilej0,Selected404,self.wallstreetbets,https://www.reddit.com/r/wallstreetbets/comments/eilej0/my_wife_spy_calls_tesla_puts/,"My Wife: Spy Calls, Tesla Puts...",1,0
eile0m,codex222,self.wallstreetbets,https://www.reddit.com/r/wallstreetbets/comments/eile0m/aurora_cannabis_acb_announces_100_billion/,Aurora Cannabis (ACB) announces $100 billion partnership deal with Coca-Cola (KO),1,2
eil7bv,therealhlmencken,i.redd.it,https://i.redd.it/gp714eoqg7841.png,Leet Alphabet,1,0
eikxa7,juxuj,nytimes.com,https://www.nytimes.com/2020/01/01/business/economy/china-economy-reserve-requirement-ratio.html,"China's Central Bank cuts reserve ratio, effectively adding $115 billion into financial system, as economic growth slows to weakest pace in 30 years",1,227
eikk0r,dirtymilkcheese,i.redd.it,https://i.redd.it/lbne1m4k77841.png,dO yOu ThiNk Im PlaYing ArOuNd?,1,0
eikbad,majinoune89,self.wallstreetbets,https://www.reddit.com/r/wallstreetbets/comments/eikbad/what_do_you_think_about_cd_projekt/,What do you think about CD Projekt?,1,0
eik4ba,blackpanther1001,self.wallstreetbets,https://www.reddit.com/r/wallstreetbets/comments/eik4ba/governments_cut/,Government's cut🇺🇸,1,0
eijzxq,Crazy_Tofu,self.wallstreetbets,https://www.reddit.com/r/wallstreetbets/comments/eijzxq/what_do_you_think_about_cd_projekt/,What do you think about CD Projekt?,1,0
eijsj5,SUP4oc,i.redd.it,https://i.redd.it/yr2b3q0hw6841.png,Searched for ACB announcement today and and this is what Google suggested next,1,0
eijht4,throwawaymyalias,i.redd.it,https://i.redd.it/04kozohpm6841.png,"A WSB lurker's 2019 results; primarily via position trading beaten down biotech stocks. Continue to entertain me in 2020, degenerates...",1,0
eijgnp,OSRSkarma,self.wallstreetbets,https://www.reddit.com/r/wallstreetbets/comments/eijgnp/tesla_delivery_numbers_thread/,TESLA delivery numbers thread,1,67
eij4ma,Swipe4Swipes,self.wallstreetbets,https://www.reddit.com/r/wallstreetbets/comments/eij4ma/oh_how_i_wish_the_market_was_open_today/,Oh how I wish the market was open today 😥,1,0
eij248,TechnicalyAnIdiot,self.wallstreetbets,https://www.reddit.com/r/wallstreetbets/comments/eij248/how_to_trade_like_a_professional_stonks_autist_in/,How to trade like a professional stonks autist in 2020.,1,21
eij20f,xxwarmonkeysxx,youtube.com,https://www.youtube.com/watch?v=efNUXXBm5jE,A tribute to /r/wallstreetbets,1,45
eiis10,Tacitly200,self.wallstreetbets,https://www.reddit.com/r/wallstreetbets/comments/eiis10/so_whats_the_deal_with_analysts/,So what’s the deal with ‘analysts’?,1,29
eiiq38,Zmurray1996,self.wallstreetbets,https://www.reddit.com/r/wallstreetbets/comments/eiiq38/ive_concluded_were_all_autistic_dumbasses/,I've concluded we're all autistic dumbasses.,1,9
eiioh0,omgoptions,i.redd.it,https://i.redd.it/n4swtbhvc6841.jpg,Going into 2020. How does my portfolio look on my etrade account.,1,1
eiio6c,omgoptions,i.redd.it,https://i.redd.it/luj0da9pc6841.jpg,Going into 2020. How does my portfolio look on my etrade account.,1,0
eiio3s,omgoptions,i.redd.it,https://i.redd.it/xttldornc6841.jpg,Going into 2020. How does my portfolio look on my etrade account.,1,0
eiio23,omgoptions,i.redd.it,https://i.redd.it/duy4v5lmc6841.jpg,Going into 2020. How does my portfolio look on my etrade account.,1,0
eiicnv,Yasai101,self.wallstreetbets,https://www.reddit.com/r/wallstreetbets/comments/eiicnv/you_people_have_ruined_me/,You people have ruined me,1,104
eii5vb,ice4200,i.redd.it,https://i.redd.it/glyof9ar16841.jpg,Oh yeh,1,0
eii46z,stcopow,i.imgur.com,https://i.imgur.com/5eNr6VK.jpg,Taking some time today to remember the original autist,1,0
eihzxb,Mustang9512,self.wallstreetbets,https://www.reddit.com/r/wallstreetbets/comments/eihzxb/acb_whats_up/,"ACB, what’s up",1,0
eihyh9,OgNitro,self.wallstreetbets,https://www.reddit.com/r/wallstreetbets/comments/eihyh9/noob_getting_started/,Noob getting started....,1,5
eih9st,AutoModerator,self.wallstreetbets,https://www.reddit.com/r/wallstreetbets/comments/eih9st/daily_discussion_thread_january_01_2020/,"Daily Discussion Thread - January 01, 2020",1,693
eih880,ermendonce,i.redd.it,https://i.redd.it/kexa2ynpe5841.png,"[SERIOUS] So, I've seen this picture on one of the most upvoted posts. Can someone tell me what's on each monitor, what he's doing and what the workflow of such a guy looks like (detailed answers only please; assume I know the basics of stocks).",1,0
eiguo4,csteemo,self.wallstreetbets,https://www.reddit.com/r/wallstreetbets/comments/eiguo4/how_many_of_you_are_on_the_spectrum/,How many of you are on the spectrum?,1,0
eigfbf,notasmellybridgetrol,self.wallstreetbets,https://www.reddit.com/r/wallstreetbets/comments/eigfbf/mro_breakout/,MRO Breakout?,1,1
eig76h,onevmone,pos.li,http://pos.li/2ec32m,Anti Aging Secrets,1,0
eig6iz,StevenMcphearson,self.wallstreetbets,https://www.reddit.com/r/wallstreetbets/comments/eig6iz/2019_in_review/,2019 in review.,1,16
eig4bp,supersap88,self.wallstreetbets,https://www.reddit.com/r/wallstreetbets/comments/eig4bp/the_sad_irony_of_tendies/,The sad irony of tendies,1,6
eifxax,Drew1904,self.wallstreetbets,https://www.reddit.com/r/wallstreetbets/comments/eifxax/happy_new_decade_and_shit/,Happy new decade and shit,1,8
eifu11,micholas_norse,self.wallstreetbets,https://www.reddit.com/r/wallstreetbets/comments/eifu11/dd_azn_mrk_got_approval_for_new_pancreatic_cancer/,DD: AZN / MRK Got Approval For New pancreatic cancer treatment,1,14
eiftuc,johntaylor37,self.wallstreetbets,https://www.reddit.com/r/wallstreetbets/comments/eiftuc/dumbest_trades_of_2019/,Dumbest trades of 2019,1,27
eifpjj,upvoteguy7,imgur.com,https://imgur.com/ljfM55V,Happy New Years!!!! 20beeniemuthafuccin20!,1,0
eifobk,ignatztempotypo,self.wallstreetbets,https://www.reddit.com/r/wallstreetbets/comments/eifobk/hot_inside_tip_amd_crashing/,Hot inside tip AMD crashing,1,5
eifjq5,Ituglobal,uk.advfn.com,https://uk.advfn.com/newspaper/azeez-mustapha/53285/annual-forecast-for-facebook-fb-2020,Annual Forecast for Facebook (FB) – 2020,1,0
eif5xu,butthole_keyi_ma_,self.wallstreetbets,https://www.reddit.com/r/wallstreetbets/comments/eif5xu/any_apps_similar_to_m1/,Any apps similar to m1?,1,6
eif5r3,tinmaster,self.wallstreetbets,https://www.reddit.com/r/wallstreetbets/comments/eif5r3/theyre_gonna_call_it_the_hindsight_2020s/,They’re gonna call it the “hindsight 2020s”,1,0
eiezi1,xEightyHD,self.wallstreetbets,https://www.reddit.com/r/wallstreetbets/comments/eiezi1/for_my_new_years_resolution_im_leaving_this/,For my new year's resolution I'm leaving this fucking subreddit.,1,0
